{
  "inherit": ["base.test_list"],
  "label": "Skip And Waive",
  "definitions": {
    "A": {
      "pytest_name": "nop"
    }
  },
  "options": {
    "skipped_tests": {
      "PROTO": [
        "A",
        "G.A"
      ]
    },
    "waived_tests": {
      "PROTO": [
        "A_2",
        "G.A_2"
      ]
    }
  },
  "tests": [
    "A",
    "A",
    {
      "id": "G",
      "subtests": [
        "A",
        "A"
      ]
    }
  ]
}
