{
  "inherit": [
    "generic_smt.test_list",
    "generic_fat.test_list",
    "generic_run_in.test_list",
    "generic_fft.test_list",
    "generic_grt.test_list"
  ],
  "label": "Main Test List for a Generic Chromebook.",
  "options": {
    "skipped_tests": {
      "device.factory.end_SMT": [
        "SMT"
      ],
      "device.factory.end_FAT": [
        "FAT"
      ],
      "device.factory.end_RUNIN": [
        "RunIn"
      ],
      "device.factory.end_FFT": [
        "FFT"
      ]
    },
    "ui_locale": "zh-CN"
  },
  "definitions": {
    "FATP": {
      "inherit": "FlattenGroup",
      "subtests": [
        "FAT",
        "RunIn",
        "FFT",
        "GRT"
      ]
    }
  },
  "tests": [
    "SMT",
    "FATP"
  ]
}
